{
  "schema_version": "1.0",
  "source_format": "claude",
  "profile": "claude-assistant-structural-v1",
  "source_records": 1,
  "events": [
    {
      "schema_version": "1.0",
      "task_id": "SYNTHETIC-native-claude",
      "agent": "claude-code",
      "timestamp": "2026-10-01T00:00:00+00:00",
      "source_line": 1,
      "id": "claude-SYNTHETIC-msg",
      "kind": "model",
      "model": "SYNTHETIC-model",
      "input_tokens": 1000,
      "output_tokens": 200,
      "cached_tokens": 400,
      "cache_write_tokens": 0
    }
  ],
  "tasks": [],
  "warnings": [
    "EXPERIMENTAL_CLAUDE_PROFILE",
    "NATIVE_TASK_OUTCOME_UNAVAILABLE"
  ]
}
